"","title","authors","year","src","id","keywords","abstract"
"101","Doctoral Degree Prestige and the Academic Marketplace: A Study of Career Mobility Within the Management Discipline.","ARTHUR G BEDEIAN DAVID E CAVAZOS JAMES G HUNT LAWRENCE R JAUCH",2010,"Academy of Management Learning & Education","722b15a5-98b3-3ab9-9de7-74b85609d729","ACADEMIC qualifications CAREER development DOCTORAL programs DOCTORAL students EMPLOYEE recruitment GRADUATE work MANAGEMENT -- Study & teaching OCCUPATIONAL mobility OCCUPATIONAL prestige ORGANIZATIONAL learning PRESTIGE REPUTATION (Sociology) UNIVERSITIES & colleges","Using data collected from a national sample of 171 PhD holders, who were awarded terminal degrees in management between 1977 and 1987, we tested four hypotheses concerning career mobility within the management discipline. We found (1) doctoral origin prestige had a direct effect on the prestige of a graduate's initial academic appointment, (2) doctoral origin prestige interacted with perceived quality of publications such that, early in their careers, graduates of more prestigious doctoral programs obtained greater job placement benefits (in terms of more prestigious initial academic appointments) from the perceived quality of their publications than did graduates of less prestigious doctoral programs, (3) later in their careers, individuals who secured more prestigious initial academic appointments held more prestigious academic appointments than individuals with less prestigious initial academic appointments, and (4) at a later career stage, initial appointment prestige interacted with perceived quality of publications, such that individuals with more prestigious initial academic appointments obtained greater job placement benefits from the perceived quality of their publications than did individuals with less prestigious initial academic appointments. Our results suggest that recruitment patterns in the management discipline reflect an inherent academic stratification system and that doctoral origin prestige is an important determinant of early and later career opportunities. [ABSTRACT FROM AUTHOR]"
"102","Grades as Money and the Role of the Market Metaphor in Management Education.","Joy E Beatty",2004,"Academy of Management Learning & Education","5bfad8dc-bf18-34ea-a7bc-61ee7c98da56","ECONOMICS EDUCATIONAL tests & measurements GRADING & marking (Students) MANAGEMENT -- Study & teaching STUDENTS -- Rating of","This article addresses grading, one process in the management education pedagogical framework, to explore how the economic metaphor underlying grading practices has shaped stakeholders' perspectives both of the purpose of education and of the meaning of grades.  It is argued that the stakeholders of higher education interpret grades as a currency that neatly quantifies learning, permitting market comparisons and exchange. This money metaphor objectifies education.  The economic metaphor and its effects on the educational process are discussed with the intent of increasing awareness of the implications of the metaphor.  The metaphorical linkages between money and grades are explained.  The social criticisms of money that help explain why the money metaphor is problematic for the education domain are reviewed.  The main criticisms offered address the intrinsic nonmaterial goals of education and the student-teacher relationship, both of which are poorly represented by the grades-as-money metaphor.  The implications of these criticisms for business schools are addressed."
"103","Does Action Learning Promote Collaborative Leadership?","Joe Raelin",2006,"Academy of Management Learning & Education","72fbe7d5-a003-3a26-aad2-41540b264fd2","ACTIVE learning BUSINESS education COLLABORATIVE learning CORPORATE culture EXECUTIVE ability (Management) LEADERS LEADERSHIP MANAGEMENT research TEAMS in the workplace","Given the need to unlock the capacity of everyone in the organization, interest in collaborative leadership is growing. But how is such a practice developed? The author proposes the use of action learning--in its original formulation, namely, through reflection on real-time work experience dealing with unfamiliar problems--as a gateway to collaborative leadership. Action learning is portrayed as growing in acceptance as a management education and learning approach that distills knowledge from a context to be used to provide learning to the practice as well as to the practitioner. The account demonstrates how the operating practices of collaborative leadership are directly affected by action learning and proposes that the two approaches are based on common principles. [ABSTRACT FROM AUTHOR]"
"104","Life Satisfaction and Student Performance.","Joseph C Rode Marne L Arthaud-Day Christine H Mooney Janet P Near Timothy T Baldwin William H Bommer Robert S Rubin",2005,"Academy of Management Learning & Education","a3d22762-526a-3982-a363-773e6c8a9006","ACADEMIC achievement ASSESSMENT centers (Personnel management procedure GRADING & marking (Students) SATISFACTION STUDENTS","Although it seems intuitively obvious that the happy student will be a more productive student, empirical tests of that assumption are curiously sparse. We tested a model that included satisfaction with various life domains, overall life satisfaction, cumulative college GPA, and ratings on an assessment center exercise. Results indicated that overall life satisfaction was a significant predictor of both GPA and assessment center ratings, even with traditional academic achievement predictors controlled (e.g., cognitive aptitude, gender). We discuss implications of the results for future research and educational practice. [ABSTRACT FROM AUTHOR]"
"105","Scholarship That Matters: Academic--Practitioner Engagement in Business and Management.","TIM HUGHES DAVID BENCE LOUISE GRISONI NICHOLAS O'REGAN DAVID WORNHAM",2011,"Academy of Management Learning & Education","f1e975cd-d70e-36c3-8526-0b1e103bdd08","ACADEMIC freedom BUSINESS -- Research BUSINESS education BUSINESS schools BUSINESS students EDUCATION INTELLECTUAL capital KNOWLEDGE management MANAGEMENT MANAGEMENT -- Study & teaching ORGANIZATIONAL behavior RESEARCH SOCIAL processes","Our research explores academic-practitioner engagement by undertaking interviews with academics, practitioners, and other experts with relevant engagement experience. The findings highlight the problem of thinking narrowly about the different ways in which engagement takes place, as well as defining narrowly what is a worthwhile activity for management academics. We develop a framework that encompasses the main ways in which engagement takes place, and that relates these to different attitude groups among both academics and practitioners. This could provide a starting point for business schools and individual academics to develop plans and put in place the processes for better engagement. [ABSTRACT FROM AUTHOR]"
"106","Introduction: Capturing the Complexity of Our Subject.","Charmine E J Härtel Kenneth G Brown",2010,"Academy of Management Learning & Education","bf4b80eb-684e-3c80-a6c2-b543779a7b8c","BOOKS -- Reviews ORGANIZATIONAL learning","An introduction is presented in which the author discusses book reviews about management learning by Jeanie Forray, Sabine Hoidn and Craig Johnson."
"107","Increasing the Value of Teaching in the Academic Marketplace: The Creation of a Peer-Review Infrastructure for Teaching.","David D Van Fleet Tim O Peterson",2005,"Academy of Management Learning & Education","5b03c048-a39c-3875-9bec-333aedc932ea","EDUCATION LEARNING LEARNING & scholarship RESEARCH TEACHING","Despite moves in the academic marketplace to broaden the definition of scholarship to include teaching and learning along with research, the value of teaching continues to be perceived as relatively low and not readily transferable from institution to institution. Our purpose here is to try to draw attention to that differential bargaining power so that perhaps some tentative first steps could be taken to remedy it. One idea for establishing appropriate value of teaching in the academic marketplace is to devise and use an infrastructure similar to that which exists for research. We provide a draft outlining one possible parallel infrastructure. [ABSTRACT FROM AUTHOR]"
"108","Introduction: Knowledge, Learning, and Impact.","Jonathan P Doh",2009,"Academy of Management Learning & Education","784bb8eb-7891-3b47-972a-eda368747802","ACADEMIC discourse BUSINESS -- Research BUSINESS education BUSINESS schools -- Faculty COMMUNICATION in learning & scholarship GHOSHAL INNOVATION management LEARNING & scholarship MANAGEMENT -- Study & teaching MASTER of business administration degree SCHOLARLY publishing SCHOLARS Sumantra UNIVERSITIES & colleges","The article discusses another article in the issue, examining the manner in which business schools measure scholarly impact. The author indicates that business school leadership is challenged by the question of how to best measure, promote, and reward scholarly impact and knowledge creation. Topics of discussion include published research that is not a function of a demand for new knowledge but the result of pressure on faculty to publish and a recommendation for a temporary moratorium on business school rankings."
"109","""Perfect Storm"" on the Horizon for Women Business School Deans?","SUSAN MCTIERNAN PATRICIA M FLYNN",2011,"Academy of Management Learning & Education","e8e2db12-62ac-3ecd-91d3-d01d6a55b446","BUSINESS schools DEANS (Education) -- Psychology EXECUTIVE ability (Management) GENDER differences (Psychology) HUMAN capital LABOR market MEN -- Psychology ORGANIZATIONAL change SOCIAL aspects TRENDS WOMEN -- Psychology WOMEN deans (Education) WOMEN executives","While business schools have been in the spotlight for many years, due, in part, to a wide range of perceived shortcomings, little attention has been paid to the scarcity of women deans. Reporting on the first study comparing the characteristics of male and female business school deans, we demonstrate that women often bring different experiences and backgrounds to these positions than do their male counterparts. Further, we assess key trends that may trigger a ""perfect storm"" and significantly change the gender mix of business deans, generating benefits that extend well beyond the campus. Recommendations for structural change in business schools to expedite this outcome are provided. [ABSTRACT FROM AUTHOR]"
"110","From the Editors What if . . . ?: Diversity, Scholarship, and Impact.","Myrtle P Bell",2010,"Academy of Management Learning & Education","2e2f940d-80ae-3c20-8c34-dd720a482a19","BUSINESS students DOCTORAL programs","The author discusses various reports published within the issue including one by Bedeian, Cavazos, Hunt and Jauch on doctoral degree prestige, one by Kelan and Jones on how master of business administration (MBA) students discuss gender and one by Petriglieri and Petriglieri on identity workspaces."
"111","Instructor Intuition in the Educational Setting.","Lisa A Burke Eugene Sadler-Smith",2006,"Academy of Management Learning & Education","1f9b63cf-f53f-3c61-96fd-e9c0478f979d","DECISION making EFFECTIVE teaching EXPERIENTIAL learning IMPLICIT learning INTUITION (Psychology) PSYCHOLOGY TACIT knowledge TEACHER effectiveness TEACHERS","In this paper we reflect upon the significance of instructors' tacit knowledge, and ultimately their intuition, in effective classroom performance. Our aim is to help educators understand their intuition and ultimately enhance their instructional effectiveness by making better classroom decisions on the basis of intuitive judgments. We outline the limits of technical-rationalist approaches and then call upon relevant constructs and processes from the intuitive domain, including tacit knowledge and implicit learning, in order to formulate a working definition of instructor intuition. We also present various types of instructional situations that are suited for intuition, along with the benefits for teaching and learning and the potential limitations. Suggestions are offered such that instructors may learn to capitalize on the advantages of using their intuition, yet minimize the disadvantages, and also on how they may educate the intuitive awareness of their students. In this way, the accumulation of learned knowledge and distilled experience within an educational setting can be more effectively leveraged to enhance the performance of individual students, the instructors themselves, and the educational institutions of which they are a part. [ABSTRACT FROM AUTHOR]"
"112","Agent-Based Modeling Toolkits NetLogo, RePast, and Swarm.","Duncan A Robertson",2005,"Academy of Management Learning & Education","af69041c-8e1a-39fe-accd-4ba552da00ce","COMPUTER simulation COMPUTER software Ill.) NORTHWESTERN University (Evanston","The article reviews several agent-based modeling computer software: NetLogo developed by Northwestern University; RePast developed by Repast Organization for Architecture and Development and Swarm developed by the Swarm Development Group."
"113","Assessing Business Scholarship: The Difficulties in Moving Beyond the Rigor-Relevance Paradigm Trap.","DAN L. WORRELL",2009,"Academy of Management Learning & Education","aa4497a6-3ef4-34e6-94d0-5348e5351027","BUSINESS education BUSINESS schools -- Faculty COLLEGE teachers -- Tenure COST control DATABASES DEANS (Education) ECONOMIC aspects MANAGEMENT -- Study & teaching RATINGS & rankings SCHOLARLY publishing SCHOOLS TEAMS in the workplace UNIVERSITIES & colleges -- Faculty WAGES","The article discusses another article in the issue, examining the challenges associated with ranking business schools, the faculty of the business schools, and the research conducted and published by these faculty. Business schools do consider the quantity of a faculty member's published works when evaluating faculty performance, the author indicates. Other topics include the necessity for business schools to be judged positively by internal university constituents and senior campus administrators."
"114","Introduction: Reflecting Backward to Move Ahead.","Jonathan P Doh",2011,"Academy of Management Learning & Education","34b1eab7-a401-3fa7-8ab5-8e4b4dc93477","BUSINESS education MANAGEMENT","An introduction is presented for this issue that mentions the Exemplary Contribution section which encourages discussion of topics in management and business education."
"115","Introduction: Listening to and Leveraging Advice.","Jonathan P Doh",2011,"Academy of Management Learning & Education","92df599c-3b68-3505-8de2-3a5d2d3fff89","BUSINESS education MANAGEMENT -- Study & teaching","An introduction is presented that discusses and article by Shaker A. Zahra, Lance R. Newey, and J. Myles Shaver on management education ."
"116","Introduction: Opening the Black Box in More Ways Than One.","Charmine E J Härtel Kenneth G Brown",2009,"Academy of Management Learning & Education","ad6aa201-d8d6-3d96-9581-163f73ea59d5","EDITORS MANAGEMENT -- Study & teaching","The article discusses various reports published within the issue, including one by Bente Elkjaer on editors who have to write decision letters in a language other then their native language, one by Jane Schmidt-Wilk on how editing a management learning journal has improved her teaching, and one by Russ Vince on the homogeneity of scholarship proceeding through the review process."
"117","Russell L. Ackoff.","Glenn Detrick",2002,"Academy of Management Learning & Education","2cbb0f70-9465-3fa1-a872-753493729a62","ACKOFF MANAGEMENT -- Study & teaching Russell -- Interviews UNITED States","Interviews Russell L. Ackoff, one of the pioneers in management education in the U.S. Career background; Views on the objective of the 'Academy of Management Learning and Education' journal; Elements to be included in an idealized plan for management education."
"118","Process Theorizing: Too Important to Ignore in a Kaleidic World.","Todd H Chiles",2003,"Academy of Management Learning & Education","6ea4f5ea-17fe-3227-a412-a70144d298a0","BUSINESS education DONALDSON, Lex MANAGEMENT MANAGEMENT science SOCIAL science research WATSON, Andrew","This article analyzes the arguments made by Lex Donaldson and Andrew Watson, university professors, about the role of theory in management education. Both Donaldson and Watson highlight the important role that theory plays in management education, but limit their discussion to variance theory--one of two fundamental types of theory in social science research. Given that variance theory has long been the dominant paradigm held by scientists and philosophers as well as the general public, it isn't surprising that both professors emphasize this orientation. Variance theory explains the variation in a dependent variable as a result of the variation in an independent variable. More generally, this approach attempts to explain a phenomenon using a small set of well-developed variables, embedded in a nomological net, tested with statistical techniques, and suited to predicting specific outcomes that are unaffected by the temporal ordering of the independent variables. Alternatively, process theory develops a causal explanation of a sequence of events over time by telling a story about how and why a phenomenon evolved as a result of the temporal ordering and probabilistic interaction of numerous events."
"119","Training Undergraduates to Work in Organizational Teams.","Gilad Chen Lisa M Donahue Richard J Klimoski",2004,"Academy of Management Learning & Education","46f009f7-631d-37bb-9b33-d7c51c766f88","COLLEGE students CURRICULA (Courses of study) HIGHER education TEAMS in the workplace UNIVERSITIES & colleges","Organizations are increasingly seeking candidates possessing high levels of teamwork knowledge, skills, and abilities (KSAs; Stevens & Campion, 1994). Yet, despite a greater emphasis in higher education settings on developing a ready workforce (e.g., O'Neil, Allerd, & Baker, 1997), not enough is done to explicitly develop teamwork KSAs in university curricula. We describe a university course intended to develop students' teamwork KSAs. Results from a quasi-experimental evaluation study demonstrate that the course significantly increased the levels of students' teamwork knowledge and skills. However, the course did not significantly improve teamwork-related attitudes and self-efficacy. We discuss implications for school-to-work policies and the development of teamwork KSAs in higher education settings, as well as directions for future research. [ABSTRACT FROM AUTHOR]"
"120","Narcissism in Management Education.","JACQUELINE Z BERGMAN JAMES W WESTERMAN JOSEPH P DALY",2010,"Academy of Management Learning & Education","dca767e9-a963-3c31-80e4-a8d9a71eede0","BUSINESS education BUSINESS students BUSINESS teachers COLLEGE students -- United States -- Psychology CONSUMPTION (Economics) EGOISM INDUSTRIAL management LEARNING PARENT & child -- Psychological aspects PSYCHOLOGY SELF (Philosophy) SELF-confidence SELF-interest STUDY & teaching UNITED States","Narcissism levels in U.S. college students have steadily risen over the past 25 years (Twenge, Konrath, Foster, Campbell, & Bushman, 2008), and these increases may be even more pronounced among business students in comparison with those in other disciplines (e.g., Robak, Chiffriller, & Zappone, 2007). This increase in narcissism has implications for both student classroom behavior and the manner in which we, as faculty, effectively teach and manage our classrooms. We explore the personality trait of narcissism, its potential manifestations in the classroom, and offer suggestions for management educators in dealing with more narcissistic students. [ABSTRACT FROM AUTHOR]"
"121","An Introduction to Collaboration with SharePoint for First-year Business Students","Laura Atkins",2009,"Journal of Information Systems Education","bce1718e-255e-367d-b86f-f6dc80b90277","collaboration collaboration exercises content sharing feedback group assignments iteration sharepoint",NA
"122","Enhancing Student Team Effectiveness: Application of Myers-Briggs Personality Assessment in Business Courses","C. H. Amato",2005,"Journal of Marketing Education","2aece24a-7d0e-3df9-b801-c25c3db3e1c8","communication myers-briggs projects teams","This article examines the relationship between student perceptions of team learning experience and communication style. Student group learning perceptions were evaluated and team communication style was measured using dyads derived from Myers-Briggs personality profiles. Groups containing similar personalities were classified as compatible, whereas groups, that blend individuals with different talents and preferences were deemed complementary. Our sample included two sections of Marketing Strategy and one Principles of Macroeconomics section. Macroeconomics students reported greater satisfaction when the group is compatible, whereas Marketing Strategy students preferred complementary groups. The number of group learning experiences and differences in group homogeneity provides likely explanations. Principles of Macroeconomics students, with little or no prior group experience, preferred the comfort of a compatible group. Alternatively, drawing on their considerable group experience, Marketing Strategy students preferred to blend the diverse talents available in a complementary group. © 2005 Sage Publications."
"123","Having Many Choice Options Seems Like a Great Idea, But . . .: Student Perceptions About the Level of Choice for a Project Topic in a Marketing Course","D. Ackerman B. L. Gross K. Sawhney Celly",2014,"Journal of Marketing Education","c0a848f1-391b-3f21-8296-7edd4a89b51a","content course creative problem solving creativity learning approaches and issues level marketing education issues methodology retailing skills student motivation surveys traits development in type of education undergraduate education","Many educators today emphasize student engagement and self-regulated learning, including giving students choices. However, research suggests that too much choice can have negative consequences such as feelings of stress and regret. An experimental design wherein students were offered different numbers of choice options when previewing, as in a syllabus or other course description, a major class project in a hypothetical Retailing Management course, examined the effects of within-course choice on perceptions of the course. The results indicate that, before they are required to engage in the course choices and make an actual decision, students prefer to have more choice. This is evidenced by their perceptions of the course’s desirability and value to their future careers, perceptions of the quality and fairness of the course instructor, and emotional reactions to the level of choice. However, when required to engage in the choice, students responded more positively to having fewer choices. Likewise, students not as interested in marketing responded more positively to having less choice. These results are more in line with findings from past research, showing that more choice can have a negative effect."
"124","A Decade of Scholarship in Marketing Education","A Abernethy . M. D. Padgett",2011,"Journal of Marketing Education","b3929796-a688-39b4-af3a-b91f9dce2c59","authorship business schools has changed content analysis decade dramatically over the last financially first marketing education the teaching environment in universi-","The teaching environment in business schools has changed dramatically over the last decade. But the last comprehensive review of the scholarship of teaching was conducted more than a decade ago. Where and from whom do the best practices for teaching originate today? To answer this question, the authors examine marketing education scholarship between 2000 and 2009 by assessing individual and institutional productivity in the two primary marketing education journals, Journal of Marketing Education and Marketing Education Review. Past findings that the most productive institutions for marketing education research were concentrated in the South no longer hold. In the last decade, interest in marketing education research is found at a large number of schools with most authors appearing only once in the two primary marketing education journals and most institutions having only one or two appearances. Higher levels of research productivity appear to be related to institutional mission."
"125","Plagiarism and Programming: A Survey of Student Attitudes.","Cheryl L Aasheim Paige S Rutner Lixin Li Susan R Williams",2012,"Journal of Information Systems Education","80760b89-c457-3eb3-91b6-eb3ee3d32818","ATTITUDE (Psychology) ATTITUDES COLLEGE students EDUCATION HUMAN behavior PLAGIARISM Plagiarism Programming RESEARCH STUDENTS Student Attitudes","This paper examines student attitudes towards a number of behaviors which range from acceptable means of seeking help on assignments to unacceptable behaviors such as copying from another student or paying someone to complete an assignment. Attitudes regarding such behaviors are compared based on the type of assignment (programming assignment, written essay, math problems). Findings indicate that students do perceive that there are differences in the acceptability of behaviors depending on assignment type. Further, the study examines the effect of an education campaign designed to increase student awareness as to which behaviors are permitted. Results suggest that faculty efforts to clarify expectations do result in a change in student attitudes regarding the acceptability of certain behaviors."
