"","title","authors","year","src","id","keywords","abstract"
"1","When Knowledge Wins: Transcending the Sense and Nonsense of Academic Rankings.","NANCY J ADLER ANNE-WIL HARZING",2009,"Academy of Management Learning & Education","1b6e9e58-2786-3dd7-b544-e3935ad22ccc","ACADEMIC discourse ACADEMY of Management BUSINESS education BUSINESS schools -- Faculty CHIEF executive officers EDITORS GARTEN, Jeffrey LAWRENCE, Peter LEARNING & scholarship MANAGEMENT -- Study & teaching RATINGS & rankings SCHOLARLY publishing SCHOOLS","Has university scholarship gone astray? Do our academic assessment systems reward scholarship that addresses the questions that matter most to society? Using international business as an example, we highlight the problematic nature of academic ranking systems and question if such assessments are drawing scholarship away from its fundamental purpose. We call for an immediate examination of existing ranking systems, not only as a legitimate scholarly question vis-à-vis performance-a conceptual lens with deep roots in management research-but also because the very health and vibrancy of the field are at stake. Indeed, in light of the data presented here, which suggest that current systems are dysfunctional and potentially cause more harm than good, a temporary moratorium on rankings may be appropriate until more valid and reliable ways to assess scholarly contributions can be developed. The worldwide community of scholars, along with the global network of institutions interacting with and supporting management scholarship (such as the Academy of Management, AACSB, and Thomson Reuters Scientific) are invited to innovate and design more reliable and valid ways to assess scholarly contributions that truly promote the advancement of relevant 21st century knowledge, and likewise recognize those individuals and institutions that best fulfill the university's fundamental purpose. [ABSTRACT FROM AUTHOR]"
"2","Management Fads.","Barry R Armandi",2003,"Academy of Management Learning & Education","34b12d84-65dc-3c24-94c9-7e175649f3fc","EDUCATION MANAGEMENT","Presents an introduction to the section entitled ""Management Fads,"" which was published in the September 2003 issue of the periodical ""Academy of Management Learning and Education."""
"3","The Effects of Cognitive Style on Research Supervision: A Study of Student-Supervisor Dyads in Management Education.","Steven J Armstrong Christopher W Allinson John Hayes",2004,"Academy of Management Learning & Education","7fc35ff9-ea91-3f67-9f18-c9438558e19d","COGNITIVE styles MANAGEMENT -- Study & teaching MANAGEMENT science SUPERVISION SUPERVISORS TEACHER-student relationships","Although attention has been paid to many aspects of teaching and learning in management education, one seriously overlooked facet is the process of research supervision. Research at both the graduate and undergraduate levels suggests that the relationship between student and supervisor is a significant predictor of success and failure in independent research projects. One personality variable shown to be partly responsible for shaping the overall effectiveness of such relationships is cognitive style, defined as consistent individual differences in how we perceive, organize, and process information; solve problems; learn; and relate to others. In this study we examined the effects of differences and similarities in the analytic--intuitive dimension of cognitive style on the supervision process. Data were collected from both partners in 421 dyadic relationships, each comprising an academic supervisor and a management student undertaking a major research project. Findings suggest that analytic supervisors were perceived to be significantly more nurturing and less dominant than their more intuitive counterparts, indicating a higher degree of closeness in their relationships. This led to increased liking in the relationship, and significantly higher performance outcomes for the student. These effects were highest in dyads whose students and supervisors were more analytic. [ABSTRACT FROM AUTHOR]"
"4","Searching for a Resource to Teach Strategy? Try Looking Here.","J Ben Arbaugh",2005,"Academy of Management Learning & Education","c7f6466d-1ebd-3499-a336-c39c4f7754d7","BOOKS -- Reviews COMPUTER simulation COMPUTER software INFORMATION resources REVIEWS TEACHING","The article introduces a series of articles reviewing books and information resources related to teaching. The publications include books such as ""Strategy Synthesis"", ""Exploring Corporate Strategy"", ""The Strategy-Focused Organization"" and several agent-based simulation modeling computer software toolkits."
"5","An Interview With Robert E. Quinn Entering the Fundamental State of Leadership: Reflections on the Path to Transformational Teaching.","Julie M Anding",2005,"Academy of Management Learning & Education","63538340-cd26-3634-b88f-4a9ef3d830f7","COLLEGE teachers LEADERSHIP MICHIGAN QUINN Robert E. -- Interviews TEACHING","The article interviews Robert E. Quinn, M.E. Tracy Collegiate Professor in Organization Behavior and Human Resource Management at the University of Michigan, on his thoughts about the relationship between teaching and the notion of entering the fundamental state of leadership. Quinn states that if people want to make the world a better place, they need to understand change."
"6","Students as Clients: A Professional Services Model for Business Education.","Michael J Armstrong",2003,"Academy of Management Learning & Education","1141485d-02e1-30dd-8dcc-2444ee928de1","BUSINESS education BUSINESS schools BUSINESS students MASTER of business administration degree TEACHING","The paper provides comments on an article about the limitations of the student-as-customer model for guiding the operations of a business school. The article proposed a student-as-junior-partner analogy. The purpose of the article is to describe a professional services student-as-client model that offers a more realistic guide for core business school operations than either the customer model or the partner model. The next section of the paper begins by noting the situations where the partner model is well suited and shows why it is not realistic for most programs. The paper then defines the client analogy, illustrates how it offers a better fit, and describes some of the insights that it suggests. For the undergraduate and MBA programs at the core of a business school's teaching activities, the client model provides a much more useful analogy than either the partner model or the customer model. On the other hand, the partner model is well suited to exceptional programs such as the Ph.D."
"7","Kocakulah_et_al-2009-Journal_of_Legal_Studies_Education.pdf",NA,NA,NA,"1f57fe1f-b84b-39c4-91ec-1c2c09c849de",NA,NA
"8","The Socratic Method 2 . 0","Matt Hlinak",2014,NA,"bb45116e-1f70-3f6a-9c25-0428c3b15945",NA,NA
"9","Anchoring for Self-Efficacy and Success : An Anchored Asynchronous Online Discussion Case","Nimer Alrushiedat Lorne Olfman",2014,"Journal of Information Systems Education","44777043-9565-3c74-ac52-bdd660d2f33d","Asynchronous learning Case study Course management system (CMS) Qualitative research & analysis Web 2.0","In recent years, we have observed a rising interest in studying the effects of Web 2.0 technologies on student learning. We learned that human behavior can be influenced by personal and environmental factors as in Bandura’s concept of “reciprocal causation.” For business statistics students, we implemented online discussions to extend student involvement beyond the walls of the classroom, increase their effort, and enhance their success. We chose business statistics because many students struggle in this course. In the past, in our efforts to aid with this issue, when we used standard online discussions, we observed that students had difficulty navigating through those discussions. They participated strictly out of compliance and several of their comments were repeats of each other. To this end, we implemented anchored discussions to assist with the navigation issue. We examined the effects of the two forms of online discussions based on the students’ feedback in essays they were asked to write at the end of the course. Using a qualitative data analysis, students’ self-efficacy emerged as an important theme. We found that anchored asynchronous online discussions (AAODs) are more likely to help increase students’ selfefficacy than standard online discussions (AODs). Moreover, AAOD students obtained statistically significant higher exam scores than students using AODs."
"10","Evaluating the Impact and Determinants of Student Team Performance : Using LMS and CATME Data","Lynn M Braender Michele I Naples Pennington Ave",2013,"Journal of Information Systems Education","afd506d4-0097-3533-b4cc-a8140831ddd3","assessment learning management system lms peer evaluation team projects","Practitioners find it difficult to allocate grades to individual students based on their contributions to the team project. They often use classroom observation of teamwork and student peer evaluations to differentiate an individual's grade from the group's grade, which can be subjective and imprecise. We used objective data from student activity logs from our Learning Management System (LMS) as well as peer evaluations from the Comprehensive Assessment of Team Member Effectiveness' website (CATME.org) to determine impacts on team grades and peer evaluations. We found that student activity in our LMS and conflict scores from peer evaluations (CATME) do correlate with grades, as do GPAs and credits earned at the College. We also found that, while the class was in session, we could use the data from the LMS and CATME scores to intervene with those teams that were experiencing conflict to help them learn productive conflict-resolution skills."
"11","Review of the Status of Cyberbullying and Cyberbullying Prevention","June F Chisholm D Ph",2014,"Journal of Information Systems Education","b42f5cc2-9323-3b52-9e4b-e7d2372ac4b6","communication technologies ethics ict information interpersonal skills networking online programming social student expectations student perceptions student responsibility virtual reality","Cyberbullying may be one of the “diseases” of the 21th Century. Despite efforts to curtail its incidence and prevalence over the past 20 years, its direct and indirect harmful effects have made it a public concern about the wellbeing of children, adolescents, and adults. Empirical studies as well as psychological theories have addressed different aspects of cyberbullying (e.g. characteristics of victims, bullies, and bystanders, prevalence rates, specific types of cyberbullying behavior, gender differences, intervention/prevention strategies, legal/legislative measures, etc.). While consensus is evident in some areas researched, significant findings in other areas are inconsistent, indicative of the inherent complexities of this phenomenon and the methodological problems hampering insight into the nature of this problem and its possible solutions. The purpose of this review is to provide an overview of the current status of the research and theoretical perspectives on cyberbullying in hopes of encouraging good scholarship, improved methodologies and thoughtful inquiries to better inform educators, parents, mental health service providers, policy makers and others so that they can more effectively promote healthy online and offline behaviors among digital users. This discussion reviews the definition and characteristics of cyberbullying, its prevalence, populations affected, gender differences, theoretical perspectives and issues of intervention and prevention."
"12","Knowledge and Skill Requirements for Entry-Level IT Workers: A Longitudinal Study.","Cheryl Aasheim J Shropshire",2012,"Journal of Information Systems Education","be62f706-3f59-3cf3-894b-9510d22f66a8","computing skills interpersonal skills job skills soft skills","This paper provides an updated view of the importance of various skills and traits for entry-level IT workers, as perceived by the IT industry, based on a web-based survey administered to IT managers nationwide. The work presented in this paper is an extension of two previous studies based on a survey conducted in 2006. A new survey was conducted in 2010 that consisted of 48 skills and traits including personal and interpersonal skills, as well as technical skills. This study finds that the top 12 skills and traits for entry-level IT workers are personal and interpersonal skills with honesty and integrity ranked most highly. The top 5 technical skills have not changed considerably in the past five years. They are operating systems, security, hardware, networking, and database, which have been part of the IT core curriculum for many years. Based on the analysis of the survey, several recommendations for curricula for IT-related degree programs are provided."
"13","Improving IS Enrollment Choices: The Role of Social Support.","a Akbulut-Bailey",2012,"Journal of Information Systems Education","1f81b2d6-584e-31ed-9c2a-1c1feb34eb05","careers curriculum design and development enrollment pedagogy student perceptions","Over the last decade, enrollment in Information Systems (IS) and related programs has dropped worldwide and still remains low despite positive job market predictions. Given the significant negative consequences of low enrollments on both academia and industry, the IS community has focused its efforts on mechanisms to increase enrollments. This study investigates how such a mechanism--social support--influences students' aspirations to pursue an IS degree. More specifically, the study suggests that social support, self-efficacy, outcome expectations, and interests independently and cumulatively affect students' choice of IS as their major. (Contains 3 tables and 3 figures.)"
"14","Planning and Sprinting: Use of a Hybrid Project Management Methodology within a CIS Capstone Course","Aaron Baird Frederick J. Riggins",2012,"Journal of Information Systems Education","e1bc40eb-91fa-3ee6-b887-980eb2853034","capstone course curriculum design development project management student perceptions teaching tips","An increasing number of information systems projects in industry are managed using hybrid project management methodologies, but this shift in project management methods is not fully represented in our CIS curriculums. CIS capstone courses often include an applied project that is managed with traditional project management methods (plan first, execute second). While agile methods (adapt to change through iterations) are making inroads, little research has been conducted on using a hybrid of these two project management methods in a capstone course. In this paper, we explain the hybrid project management methods we used in four sections of an undergraduate CIS Capstone course during the Fall and Spring of the 2011-2012 academic year. We also present the results of an end-of-term student satisfaction and critical success factor survey. We find that overall satisfaction with the hybrid approach is high among our sample. We also find that more client involvement and a pragmatic approach to initial project planning are areas for future improvement. The results of our experience and survey provide lessons learned and best practices for those who wish to provide students with applied experience that combines waterfall (traditional) and Scrum (agile) project management techniques in their own courses. [PUBLICATION ABSTRACT]"
"15","Teaching Tip Using Rapid Game Prototyping for Exploring Requirements Discovery and Modeling","Nikunj Dalal",2012,"Journal of Information Systems Education","1a4c3afe-6203-33a4-b88d-6c9825e291d1","modeling requirements analysis specification systems analysis and design systems thinking teaching tip","We describe the use of rapid game prototyping as a pedagogic technique to experientially explore and learn requirements discovery, modeling, and specification in systems analysis and design courses. Students have a natural interest in gaming that transcends age, gender, and background. Rapid digital game creation is used to build computer games quickly and easily using game creation software that requires little or no programming knowledge. It enables the developer to build a quick prototype game and to view the effects of changes almost immediately. The process can be seen as learning-by-making and learning by-design, which are grounded in the learning theories of social constructivism and constructionism. Viewing the game as a system, students worked on an assignment to create a game prototype for a user, determine requirements, and specify the requirements using use-case diagrams and UML class diagrams. Students found this approach innovative, instructive, and entertaining. We describe this approach and outline its benefits. (Contains 1 table and 2 figures.)"
"16","Wiki or Word ? Evaluating Tools for Collaborative Writing and Editing","Mark Dishaw Michael a. Eierman Jakob H. Iversen George C. Philip",2011,"Journal of Information Systems Education","64fff130-4ced-3e2f-bb3b-df9d49840310","Computer-Mediated Communication (CMC) Task-Technology Fit Team Projects Technology Acceptance model (TAM) Technology-Mediated Collaboration Virtual teams","Businesses and other organizations are relying increasingly on virtual teams to perform a range of business activities. A key challenge in utilizing virtual teams is to support collaboration among team members who are separated by distance and/or time. In this paper we use a research model based on a combination of the Technology Acceptance Model (TAM) and the Task Technology Fit (TTF) model to examine two approaches to supporting students in collaboratively creating and editing a report for an introductory course in information systems. In our study, one group of students used MS Word with Track Changes turned on combined with emailing the document among students. A second group was provided access to a wiki where they created the report. Results show that students found the Word and email combination more useful and easier to use than the wiki environment in completing the project. Further, there was no perceived difference in the effort of collaboration between the two methods. This study raises questions about the widely held belief that web-based collaboration platforms are superior to emailing documents among collaborators."
"17","Teaching Case Jay ’ s Collectibles","James J Cappel Jason R Gillman",2011,"Journal of Information Systems Education","2985ac63-ac6f-3f74-9c0a-f5ce18903e11","case study data modeling systems analysis and design team projects","There is growing interest in collectibles of many types, as indicated by the popularity of television programs such as the History Channel's ""Pawn Stars"" and ""American Pickers"" and the Public Broadcasting Service's ""Antiques Road Show."" The availability of online auction sites such as eBay has enabled many people to collect items of interest as a hobby and to sell parts of their collection as a business or for extra income. As a collection grows, it becomes increasingly difficult to track through manual methods, and it is often useful to develop a computer-based system for this purpose. This case raises the possibility of developing an information system to manage a collection of sports autographs. This case may be used in a systems analysis and design, database, or systems development course to address a number of important topics such as: systems scope identification, problem and opportunity analysis, requirements analysis, data modeling, and application development. The case is designed to provoke interest and raise a sufficient level of complexity to challenge students to apply a range of systems development and database concepts. While the case addresses sports collectibles, its concepts may be applicable other types of systems, especially those involving other types of collections or ""one of a kind"" items. Since many students are likely to have at least some experience using online auction sites, following professional sports, seeing television programs about collectibles, or attending flea markets where collectibles are sold, the case builds in some way on their life experience. This teaching case enables students to discover how systems development and database concepts are applicable to a practical problem solving scenario."
"18","Procyon LLC: From Music Recommendations to Preference Mapping.","Susan J Chinn",2011,"Journal of Information Systems Education","0f593f1b-87d3-3ee3-abf2-981862babcc0","Business planning Business-to-business transactions Business-to-consumer transactions Case study E-commerce Music -- Computer network resources Music libraries Procyon LLC Strategic alignment & deployment","Procyon LLC had re-launched and renamed their music discovery site, Electra, to Capella, in 2008. Its core strength had originated from Electra's proprietary technology, which used music libraries from real people, its members, to generating ""automated word-of-mouth"" recommendations, targeted advertising and editorial content. With the re-launch, Capella's focus changed from a business-to-consumer destination site to a demonstration site for Procyon as it pursued a new business-to-business strategy. What led Procyon to make this strategic change' What products and services should it market, and to whom' This case describes the transition from music recommendation to preference mapping, and provides students with a variety of alternative partnering options to consider as they move forward. [ABSTRACT FROM AUTHOR]"
"19","The challenge of implementing an ERP system in a small and medium enterprise--a teaching case of ERP project management.(Teaching Case)(Report)","Hongjiang Xu Patrick J Rondeau Sakthi Mahenthiran",2011,"Journal of Information Systems Education","064f456f-f939-3df8-b359-05fd46d4324c","Management Research United States","Enterprise Resource Planning (ERP) system implementation projects are notoriously risky. While large-scale ERP cases continue to be developed, relatively few new ERP cases have been published that further ERP implementation education in small to medium size firms. This case details the implementation of a new ERP system in a medium sized manufacturing firm. As students explore the case, they will be required to address the many ERP-related project management, procurement, human resource, and management involvement issues raised by it. This case highlights the ERP implementation problems experienced by case company in one of their two divisions. The firm is considering whether or not to implement this same ERP system in its other division. Before proceeding, the firm's board of directors has concluded that a review of the first division ERP implementation is needed. They believe that such an assessment could provide valuable insight and lessons learned, giving rise to improvement of the second division's ERP implementation outcome."
"20","Team learning in technology-mediated distributed teams","Hayward P Andres Belinda P Shipps",2010,"Journal of Information Systems Education","32f8494c-7e73-394d-9e99-37fe3f8778ba","EDUCATIONAL technology HIGHER education LITERATURE reviews MATHEMATICAL models METHODOLOGY PROBLEM solving SOCIAL impact SOCIAL structure TEAM learning approach in education observation research social impact theory team learning technology-mediated collaboration","This study examines technological, educational/learning, and social affordances associated with the facilitation of project-based learning and problem solving in technology-mediated distributed teams. An empirical interpretive research approach using direct observation is used to interpret, evaluate and rate observable manifested behaviors and qualitative content (i.e. discussions) associated with project-based team learning. The theory of affordances and social impact theory are integrated to develop a conceptual model that asserts that collaboration mode (collocated vs. non-collocated and videoconferencing supported) will dictate the quality of information exchange, progressive elaboration of ideas, and the social processes that influence team learning. Team learning is then suggested to yield better productivity and higher perceived interaction quality. Results showed that collaboration mode can impact team information exchange and interpretation and ultimately task outcomes. Further, collaboration mode can also create a social structure that influences the capacity for a team to maintain a mutual supportive and positive climate needed for successful project-based task outcomes. The results offer some extended insights into the technology-mediated collaborative learning process among students in a higher education context as well as in organizational settings. Theoretical, methodological and practical implications of the study are discussed."
