"","title","authors","year","src","id","keywords","abstract"
"239","Using the Diary Method to Deal With Social Loafers on the Group Project: Its Effects on Peer Evaluations, Group Behavior, and Attitudes","C. J. Dommeyer",2007,"Journal of Marketing Education","de3da976-d92a-3734-9bcb-97ea5c8107c3","diary free rider loafer peer evaluation","This article reports on the use of group and individual diaries to control social loafing on the group project. Although both forms of the diary were designed to prevent social loafing, neither appeared to do so. An unexpected result of the indi- vidual diaries is that they appeared to make the majority of the class, namely the nonloafers, more aware of and less tolerant of their loafing partners. Consequently, firings of group members were most likely to occur when individual diaries were used. This article shows how the diary method affects peer evaluations and group behavior, investigates the convergent validity of the individual diary, and summarizes students attitudes toward the diary method."
"240","A Gap Analysis Approach to Marketing Curriculum Assessment: A Study of Skills and Knowledge","R. Davis S. Misra S. van Auken",2002,"Journal of Marketing Education","13d13a27-f81d-3370-844e-d4dc3e0bff05",NA,"The need for continuous improvement in a marketing curricu- lum requires periodic outcomes assessments. Part of the pro- cess includes a monitoring of the relevance of a marketing curriculum to a graduate’s work environment. This article describes a process for conducting an outcomes assessment and the results of an actual alumni assessment encompassing skill and knowledge areas. Specifically, a gap analysis approach was employed in which the importance of key skill and knowledge areas to one’s current employment were con- trasted with perceptions of their own academic preparation in these areas. Our results indicate that marketing alumni perceive that they are underprepared in skills and over- prepared in designated knowledge areas. The implications of the findings are discussed as well as the utility of the gap anal- ysis in outcomes assessment."
"241","Further Thoughts on the Marketing Trifid: The Case of Marketing Orientation","S. Dibb P. Stern",2000,"Journal of Marketing Education","8fc607d6-4c43-3339-b5d0-2d3cb0352bae",NA,"Marketing instructors are faced with an array of subject material from a wide variety of sources. These sources can be broadly grouped into three spheres of influence: the researcher, the teacher, and the practitioner. These three influences are considered as elements along two dimensions, contribution and conduct. The problems faced by instructors as they attempt to present a balanced view of a specific topic in class are explored. This marketing trifid, as it has been termed, is illustrated using the concept of marketing orientation and is equally applicable to other theoretical concepts."
"242","Narrowing Skill Development Gaps in Marketing and MBA Programs: The Role of Innovative Technologies for Distance Learning","S. G. Dacko",2001,"Journal of Marketing Education","f708b1cc-6c35-3a43-bb4f-df35386ab5d5",NA,"Increasingly, universities are offering a marketing education to a diverse, international student population through formats including both full-time and distance-learning MBA programs. At the same time, universities are increasing their reliance on technology innovations that enhance students' global learning experience. Ultimately, a key measure of success of such programs and technological approaches is the extent that participant needs for business skill development are being met. This article proposes that the role of technological innovation in facilitating or hindering business skill development in a distance-learning MBA program can be better understood by understanding: 1. how and why student needs for marketing and business skill development can differ within and across MBA programs and 2. how technological innovations can contribute to - or potentially limit - the development of specific skills desired by marketing and business students"
"243","Student Ratings and Evaluation in Undergraduate Business Law Courses: A Modest Correlative Study","Lucien J. Dhooge Cynthia F. Eakin",2007,"Journal of Legal Studies Education","7a17fd14-2fab-3beb-972c-e02f04edaba3",NA,NA
"244","Enriching Our Understanding of Student Team Effectiveness","Dawn R. Deeter-Schmelz Karen Norman Kennedy Rosemary P. Ramsey",2002,"Journal of Marketing Education","30ec4907-12ca-3919-a278-c630ae51f300",NA,"Asteam projectsbecome ever more common in businessand in the marketing classroom, an increased understanding of factors contributing to team effectiveness is necessary for instructors to assist students in realizing the potential benefits of thispeda gogical tool. Drawing from a wide base of literature on team research, the authors develop an input-process- output model of team effectiveness. Using data from 85 teams from marketing classes, this model was tested. Results support the positive and direct role of cohesion as an input variable on the process variable of teamwork. Additional relationshipsar e explored, and the implicationsof the research findings are discussed with practical suggestions for the marketing classroom."
"245","Relating Pedagogical Preference of Marketing Seniors and Alumni to Attitude toward the Major","R. Davis S. Misra S. van Auken",2000,"Journal of Marketing Education","01ebc720-fd6e-312f-8437-b062f863501e",NA,"Learning styles of marketing students have changed over the years. Changes have also occurred in emphases placed by the American Assembly of Collegiate Schools of Business, uni- versities, schools, and departments on meeting student learn- ing needs. This study measures the pedagogical preferences of marketing seniors and alumni and relates them to a global attitude toward the marketing major. This approach may be used in any marketing program as a potential attitudinal enhancementmechanism, since key pedagogies can be identi- fied. In turn, the motivation and learning potential of pedagogies can be evaluated. Results indicate an association between in-class activities and overall attitude toward the marketing major. Higher"
"246","Mobile App Development to Increase Student Engagement and Problem Solving Skills","Sonal Dekhane Xin Xu Mai Yin Tsoi",2013,"Journal of Information Systems Education","8c836034-85cc-3505-bcdd-302dd47302a8","creative problem solving critical thinking general education mobile computing","This paper describes a project designed to promote problem solving and critical thinking skills in a general education, computing course at an open access institution. A visual programming tool, GameSalad, was used to enable students to create educational apps for mobile platforms. The students worked on a game development project for the entire semester, incorporating various skills learned throughout the semester. Pre and post quiz analysis showed a significant improvement in students’ ability to design comprehensive solutions to a given problem. Survey results also showed increased student engagement, high interest in computing and a “better” understanding of information technology."
"247","Be a Good Teacher and Be Seen as a Good Teacher","S. Desai E. Damewood R. Jones",2001,"Journal of Marketing Education","a2a20386-e3df-3779-91a8-40989c0f8ac7",NA,NA
"248","of Student Evaluation Data","Sara Dolnicar Bettina Grün",2009,"Journal of Marketing Education","aff81184-a08f-3914-9486-79f8cbdb9623","answer format likert-type scale ordinal response style satisfaction student evaluations survey",NA
"249","Using Innovative Technology to Develop Sustainable Assessment Practices in Marketing Education","J. C. W. Debuse M. Lawley",2011,"Journal of Marketing Education","ae0caea4-e4ac-3ff6-840f-c3719936ca2c","action research assessment assessment software computer-based marking feedback function of mar- keting educators learning is a core sustainability the assessment of student the key focus of traditionally"," Timely, constructive feedback on assessment is critically important to students and yet is increasingly difficult for time-poor academics to consistently provide. Marketing educators also face pressure to incorporate sustainability into both the curriculum and practices such as assessment. This article outlines the development of an innovative computer-based marking tool, SuperMarkIt (SMI), which promotes sustainability. Using an action research method, this article reports the results of the sixth cycle of review and improvement with data gathered from both educators and students. Results support the improvements in sustainability achieved by using SMI. Educationally, students report improved feedback quality in areas such as timeliness, legibility, constructiveness, personalization, and detail. Economically, academics report major increases in feedback quantity, and students report reductions in time and cost. Environmentally... "
"250","Call for Papers: Marketing Educator's Association. Submission Deadline: October 31, 2008","Submission Deadline",2008,"Journal of Marketing Education","a37f8025-0a2e-3173-9971-bdbb3e04eac5",NA,NA
"251","Can Australian Universities Take Measures to Increase the Lecture Attendance of Marketing Students?","S. Dolnicar S. Kaiser K. Matus W. Vialle",2009,"Journal of Marketing Education","759efdca-26ab-3ea8-8424-58836d563642","a priori market segmentation australia lecture attendance","Lectures are a central element of traditional university learning, but Australian lecturers increasingly face very low levels of lecture attendance. A significant amount of research exists that investigates the drivers of lecture attendance. However, those studies typically study single factors in an isolated manner, thus overestimating the importance of individual factors. This study contributes to the understanding of lecture attendance (and nonattendance) by including a range of factors that potentially affect lecture attendance simultaneously, thus accounting for possible interactions between factors and identifying the key drivers of lecture attendance. The study uses a survey among all students of an Australian university to compute a regression model with the probability of lecture attendance as the dependent variable. Results indicate that only four of the factors previously investigated are significant for marketing students (i.e., the difficulty of the subject, the quality of the lecture as perceived by the student, the quality of the student as indicated by his or her average mark, and the format of the lecture), which leaves little opportunity for Australian universities to improve attendance with simple measures. Instead, the data suggest that universities need to improve the quality of lectures to achieve better attendance levels."
"252","Balancing Work With Study: Impact on Marketing Students' Experience of Group Work","S. D'Alessandro S. Volet",2012,"Journal of Marketing Education","4a717957-c6a0-3c0f-a363-15b555339673","group learning group projects introduction and context number of financial pressures students face an increasing study balance that work","Approximately 57% of students in the United States work while attending college. For most of these students (81%), this is more than 20 hours a week. There has been shown to be a negative relationship between hours worked and academic achievement in studies in the United States as well as the United Kingdom and Australia. There is, however, no research to the authorsâ€™ knowledge as to how the number of working hours affects student learning in groups, and whether students in groups with varying work patterns report better learning outcomes in groups where student working hours are similar. This study reports that overall, greater working hours decrease studentsâ€™ perceptions of the value and their experience of group work, and this occurs more with second- and third-year students. It also reveals that students studying in groups where there is a large proportion of students working more than 2 days a week displayed significantly more negative appraisals of their experience at the end of a project than their peers in groups where few students were working."
"253","Student-Operated Internet Businesses: True Experiential Learning in Entrepreneurship and Retail Management","S. P. Daly",2001,"Journal of Marketing Education","3cd87a18-b755-3d35-a7a7-84ca53ed3959",NA,"Using the Internet, students can create and carry through to completion their own business plans, from product development to marketing and promotions to operations. As measured by student satisfaction and content analysis of student reflection papers, this new technique is an effective way to study real-world entrepreneurship and retail management, especially in terms of developing Internet skills. Side benefits include increased fund-raising and membership for student organizations, increased community interaction, and free publicity for the host institution. The article provides observations and recommendations concerning the successful operation of student-operated Internet businesses."
"254","Educational Blogging","Stephen Downes",2004,"Journal of Marketing Education","d73e652b-9627-382a-a91d-c17aeb71ff1d","and blogs experiential learning globalization has undergone in marketing education n recent decades particularly driven by advances revolutionary changes soft skills development technology and information systems technology integration the world of business","Discusses the use of weblogs in education. Definition of weblogs according Theresa Ross Embrey; List of weblogs that are useful as sources of professional information for teachers and teacher-librarians; Use of weblogs to promote literacy in the classroom."
"255","An Empirical Examination of the Composition of Vocational Interest in Business Colleges: MIS vs. Other Majors","James Downey",2011,"Journal of Information Systems Education","8a36a092-1bf3-3870-81fb-495fc769e5b0","BUSINESS schools COLLEGE majors COMPUTER science Careers Computing majors MANAGEMENT information systems METHODOLOGY SAMPLING (Statistics) STUDY & teaching (Higher) Student expectations Student perceptions VOCATIONAL guidance VOCATIONAL interests","Given the diminishing number of Management Information Systems (MIS) majors, an understanding of the factors which influence student choice of major is crucial. It has been noted in many previous studies that interest in a major and career significantly influences the student's choice of college major; indeed, in most studies, it is the strongest influence. Yet extant studies treat interest as a one-dimensional construct; in fact, interest is multi-dimensional, that is, it is comprised of many factors. This study examines the construct of interest and in particular the factors which contribute to vocational interest among business college majors. Using a sample of 452, it compares and contrasts the significant influences on vocational interest among two groups: MIS majors and non-MIS business majors. Findings indicate both similarities and differences between the two groups, leading to constructive recommendations for increasing interest in MIS with the intention of increasing the number of majors. [ABSTRACT FROM AUTHOR]; Copyright of Journal of Information Systems Education is the property of Journal of Information Systems Education and its content may not be copied or emailed to multiple sites or posted to a listserv without the copyright holder's express written permission. However, users may print, download, or email articles for individual use. This abstract may be abridged. No warranty is given about the accuracy of the copy. Users should refer to the original published version of the material for the full abstract. (Copyright applies to all Abstracts.)"
"256","Explaining the Appeal of Sales Careers: A Comparison of Black and White College Students","S. DelVecchio E. D. Honeycutt",2002,"Journal of Marketing Education","44d98c62-2a34-3285-afd6-0ebc993e33f6",NA,"As firms attempt to broaden the racial diversity of their corporatesales force through recruiting activities, the perceptionsof sales careers held by college recruits is an important issue.Although both black and white college students rate salescareers as being less appealing, previous research suggeststhat students differ in how they reach this conclusion. Thepurpose of this investigation, therefore, is to examine thebasis for the low appeal ratings normally ascribed to salescareers by black and white college students. The findings ofthis study suggest that black and white students attach a similarimportance to the job attributes of starting salary, autonomy,and education when rating sales career options. Thesefindings imply that educational efforts aimed at improving theperceptions of the salary and autonomy levels offered by acareer in sales can be equally effective for both racial minorityand majority students"
"257","A Need to Revamp Textbook Presentations of Price Elasticity","J. R. Dickinson",2002,"Journal of Marketing Education","9b0ee97a-7fe2-3895-b7e9-d936f40dd00e",NA,NA
"258","Uniting Active and Deep Learning to Teach Problem-Solving Skills: Strategic Tools and the Learning Spiral","N. Diamond S. K. Koernig Z. Iqbal",2008,"Journal of Marketing Education","d2e78fc9-0cef-3b7d-8464-ca2ab9c9c9e8","active learning application deep learning in courses like principles long on concepts and marketing education ndergraduate marketing education is of marketing and consumer often described as problem-solving skills quantitative tools theory and short on","This article describes an innovative strategic tools course designed to enhance the problem-solving skills of marketing majors. The course serves as a means of preparing students to capitalize on opportunities afforded by a case-based capstone course and to better meet the needs and expectations of prospective employers. The course format utilizes active and deep learning to provide students with the ability to identify a marketing problem, select and use a strategic marketing tool or set of tools appropriate to its solution, collect and analyze relevant data, and make concrete data-based recommendations. Knowledge of the problem identification-to-recommendation process is enhanced via a ""learning spiral,"" which requires students to apply additional tools in different contexts, thus increasing their breadth and depth of understanding. The authors describe in detail two of the strategic tools that comprise course content (perceptual mapping and conjoint analysis). Finally, the article discusses the rewards and challenges that can be anticipated by those teaching the course."
"259","Piracy Among Undergraduate and Graduate Students: Influences on Unauthorized Book Copies","P. Dionisio C. Leal H. Pereira M. F. Salgueiro",2013,"Journal of Marketing Education","161c0cbc-0350-327b-893f-4bc3327376f0","illegal behavior or black markets portugal poses a significant threat products distributed by informal the phenomenon of piracy to the profitabil- unauthorized copies undergraduate education",NA
"260","Together We Innovate: Cross-Cultural Teamwork Through Virtual Platforms","R. Duus M. Cooray",2014,"Journal of Marketing Education","bd2753a5-5957-3104-aa8b-aa7a12c62240","cross-cultural collaboration employability innovation in marketing teamwork virtual platforms",NA
"261","Teaching Law and Theory Through Context: Contract Clauses in Legal Studies Education","Larry a. DiMatteo T. Leigh Anenson",2007,"Journal of Legal Studies Education","bca067c5-5083-3508-9bbf-fc0c96d16e7c",NA,NA
"262","A New Strategy for Dealing With Social Loafers on the Group Project: The Segment Manager Method","C. J. Dommeyer",2012,"Journal of Marketing Education","55af652f-f1e1-3ca6-bef7-2b05777f3f7a","2008 aggarwal batra brien classes free rider group grading group project group projects are becoming individualized grades more popular in business o school slacker social loafing walvoord","Professors often give members of a group project the same grade or they use peer evaluations to provide individualized grades. Unfortunately, both these methods have shortcomings. This article describes the segment manager method (SMM), a method for assigning individualized grades on the group project that does not rely on peer evaluations. A quasi-experiment is described where marketing research students are graded in groups either with peer evaluations (the control group) or with the SMM (the treatment group). Students participating in the quasi-experiment were more likely to prefer the SMM over the approach that uses peer evaluations. Moreover, when the SMM is compared with the peer evaluations approach, the SMM appears to be more likely to generate individualized grades on the group project that reflect each student's academic ability, to deter social loafing, to increase scores on the group project, and to increase scores on an exam that is heavily loaded with project material. Recommendations for future users of the SMM are offered. © The Author(s) 2012."
"263","Field Site Visits","Doris Van Doren Hope Bober Corrigan",2008,"Journal of Marketing Education","e3a728b2-3180-3c43-a46b-9b23569c9183","career development eaching marketing for the experiential learning in this concentration innovative teaching marketing courses observed that business students past 20 years site visits we have",NA
"264","The Future of Marketing Scholarship: Recruiting for Marketing Doctoral Programs","D. F. Davis",2005,"Journal of Marketing Education","50d65a18-2319-3776-aa38-38b977d0a514","assuring continued rigor of business education business education and research con- doctoral education doctorally trained individuals are in ing doctorates market- student recruiting the most essential element trends",NA
"265","The Personal Selling Ethics Scale: Revisions and Expansions for Teaching Sales Ethics","C. Donoho T. Heinze",2011,"Journal of Marketing Education","60a31568-0a03-3a19-921d-7052a6ca9567","codes of ethics moral idealism personal selling ethics scale relativism sales scenarios scale development","The field of sales draws a large number of marketing graduates. Sales curricula used within today’s marketing programs should include rigorous discussions of sales ethics. The Personal Selling Ethics Scale (PSE) provides an analytical tool for assessing and discussing students’ ethical sales sensitivities. However, since the scale fails to address many ethical issues within the personal selling process, it should be revised. The current research assessed the PSE’s content validity via a content analysis of today’s university sales texts, popular press sales books, and codes of ethics. Results of the content analysis were used to develop a revised scale (PSE-2) that includes new scenarios suggested by the literature search. A sample of 669 students was used to replicate the original study and test the revised PSE-2 and its new ethical scenarios. The updated scale offers marketing educators an effective tool by which to enhance sales ethics discussions."
"266","Study Abroad Learning Activities: A Synthesis and Comparison","C. R. Duke",2000,"Journal of Marketing Education","1a6d01cc-64df-3ba0-a0a0-e4baafa85aa8",NA,"Learning activities are described for study abroad tours with appropriateness discussed in terms of study tour characteristics of location, integration with academic credit, and time spent on the tour. Journal writing is the most versatile activity. Company visits are the most impressive to students. Simulations engage students but require computer technology. Projects require sufficient research resources. Lecture/testing and treasure hunts require more time on tour. [ABSTRACT FROM AUTHOR]"
"267","Using Participatory Photo Novels to Teach Marketing","K. Das",2012,"Journal of Marketing Education","a82ef968-bf72-3ee6-9126-845a78eb3c28","1982 and 2003 also termed generation y and born roughly between gen y generation y innovative pedagogy learning outcomes marketing education photo novel short the young generation of today",NA
"268","Demonstrating Operating System Principles via Computer Forensics Exercises.","Kevin P Duffy Martin H Davis Allyn Hall",2006,"Journal of Information Systems Education","ba3fb4e2-639c-3dc3-9bb1-3ecbe0ec1fbc","class exercises computer forensics mis major operating systems","We explore the feasibility of sparking student curiosity and interest in the core required MIS operating systems course through inclusion of computer forensics exercises into the course. Students were presented with two in-class exercises. Each exercise demonstrated an aspect of the operating system, and each exercise was written as a computer forensics investigation. Students were asked to indicate their perception of the practicality of the course material before and after completing the exercises. Based upon a t-test, we conclude that students find the course material to be of greater practical significance when course materials are linked to forensics topics. (Contains 1 table.)"
"269","to JOURNAL OF MARKETING EDUCATION Volume 28 Number 1 ( April 2006 ) pp . 1-88 Number 2 ( August 2006 ) pp . 89-176 Number 3 ( December 2006 ) pp . 177-272 Authors : Articles :","S David Barbara L Gross How Many D Nancy L Sara Kathleen A Krentler J Scott W John L Christopher K A M C Chan Pikki Lai C Kam Clarke Iii Theresa B Flaherty E Dennis Mary Jane Sheffet Participative Case Studies Integrating",2006,"Journal of Marketing Education","990a4a63-6796-3aaa-873e-df01d2c98baf",NA,NA
