"","title","authors","year","src","id","keywords","abstract"
"348","Blissful Ignorance: The Problem of Unrecognized Incompetence and Academic Performance","E. J. Kennedy L. Lawton E. L. Plumlee",2002,"Journal of Marketing Education","f3769e36-0d8a-3d66-ad89-2d8c4c855768",NA,"The skills that develop competence in a particular area are often the same skills needed to evaluate competence in that area. When people are unable to judge their own achievement, they are in a double bind; they have neither a particular skill nor the cognitive ability to realize their own level of incompetence. If students are unaware of their poor performance on tests, they are unlikely to realize their limitations. Correspondingly, the high performers may not recognize their ability to be successful. This study tests students' self-recognized competence by having them estimate the grade they expected to receive on a test immediately following its completion. Poorer students significantly overestimated their performance; better students underestimated their performance. Poorer students became better estimators over time, while there was no similar improvement in better students' self-assessments."
"349","Creating and Executing an Applied Interdisciplinary Campaign for Domestic Violence Prevention","S. N. Keller a. J. Otjen",2007,"Journal of Marketing Education","8ba1c6c6-836f-33b5-9ea7-3f3af345332e","applied learning cause domestic violence education espite an emerging consensus expe- few scholars health communication marketing on the importance of riential learning in marketing social marketing","This article describes an interdisciplinary, experiential learning project that combined marketing and communications courses at a state university. Two professors from different colleges partnered with a domestic violence center to enable students to create a community-based social marketing campaign. Student assessments indicated success in achieving educational objectives and practical knowledge. The resulting multimedia campaign was well received throughout the state and illustrates opportunities for developing interdisciplinary knowledge and teaching in business and communication studies. © 2007 Sage Publications."
"350","The Effects of Class Size and Learning Style on Student Performance in a Multimedia-Based Marketing Course","F. Karakaya T. L. Ainscough J. Chopoorian",2001,"Journal of Marketing Education","314f38b5-815b-3a00-88f7-95bda6e5a87c",NA,NA
"351","Assessing the Trends and Challenges of Teaching Marketing Abroad: A Delphi Approach","C. a. Kelley",2007,"Journal of Marketing Education","8c0f5bf4-af42-3f5c-8fdf-93ed6e5887ca","best teaching practices delphi method ing international marketing student learn- teaching",NA
"352","The Case for Using Live Cases: Shifting the Paradigm in Marketing Education","E. J. Kennedy L. Lawton E. Walker",2001,"Journal of Marketing Education","d006d476-b8db-3336-a38d-88abb96824e9",NA,NA
"353","Application of Contemporary Literature to Enhance Interpersonal Skills and Ethical Decision Making in Professional Selling Coursework","B. Kimball",2007,"Journal of Marketing Education","ee405adb-450b-3613-9c3b-060739afd719","communication education ethics literature","Educators and marketing professionals agree that course-work must address interpersonal communication skills and ethical decision making in addition to traditional business functions and skills. This article describes an innovative approach to teaching the professional selling course in which students enhance their competency in these areas through assigned readings in contemporary American literature. Students read starkly contrasting works by Jack Kerouac, Kurt Vonnegut, and Ayn Rand that present dramatic comparisons of individuals and their personal and professional paths, helping students appreciate the skills and ethical foundation essential to success as a professional salesperson. Reaction to this innovative approach has been extremely positive, with very high course evaluations and comments praising the value of literature as a learning laboratory that provided an understanding and appreciation of these issues. This approach could readily be applied to numerous other business courses addressing interpersonal communication, ethics, or other critical issues with works of contemporary literature."
"354","Planning, Organizing, and Conducting a 2-Week Study Abroad Trip for Undergraduate Students: Guidelines for First-Time Faculty","S. K. Koernig",2007,"Journal of Marketing Education","38fcbd4e-2e01-3152-a724-30adaa16fe4a","can light the rest company tours cultural activities elevating our if struck at just learning activities of our lives rapport spark in us all study abroad the right age there is a flickering which",NA
"355","Structured Case Analysis: Developing Critical Thinking Skills in a Marketing Case Course","J. M. Klebba J. G. Hamilton",2007,"Journal of Marketing Education","3cdbdceb-7002-3f88-a774-09162e8aa6a0","case analy- critical thinking experiential learning ing marketing strategy problem-based learn- sis structured learning","Structured case analysis is a hybrid pedagogy that flexibly combines diverse instructional methods with comprehensive case analysis as a mechanism to develop critical thinking skills. An incremental learning framework is proposed that allows instructors to develop and monitor content-specific theory and the corresponding critical thinking skills. Structured exercises are used initially to examine theory and augment critical thinking skills. The degree of structure decreases progressively as students develop these skills and master theory. The process culminates in traditional (unstructured) case analysis. This discussion explores the characteristics and benefits of structured case analysis and describes how the method can be implemented in a marketing case course. The incremental learning framework fosters metacognition and task generalization. Structured case analysis can be adapted to courses that seek to develop critical thinking and marketing decision making."
"356","Alternative Approaches for Educating Future Global Marketing Professionals: A Comparison of Foreign Study and Research-Intensive Marketing Programs","P. a. Kaufman H. L. Melton I. I. Varner M. Hoelscher K. Schmidt a. D. Spaulding",2011,"Journal of Marketing Education","57fa7e46-88d5-3dbe-87fe-c2669277ff00","a national ini- american exports within 5 experiential learning federal government has established foreign study programs global marketing professionals international study s study abroad the u tiative to substantially increase","On the one hand “Alternative Approaches for Educating Future Global Marketing Professionals: A Comparison of Foreign Study and Research-Intensive Marketing Programs” is a case-study of a new style of international study abroad for marketing students; on the other hand, this article gives a detailed overview it of study abroad, study tours, and international internships in the field of business. It compares and contrasts learning outcomes of these different styles of international education, and concludes with a discussion of the Global Marketing Program (GMP) which the authors believe best serve students"
"357","Development of a Web-Based Internet Marketing Course","S. a. Kaynama G. Keesling",2000,"Journal of Marketing Education","aae6219d-2572-3a2a-b128-906f5677172f",NA,"This article presents the results of the systematic development and implementation of an interactive course on Internet marketing. A seven-step systems model was used to create the technologically integrated course. The course is an online, hands-on workbook, which presents marketing concepts through a sophisticated Web-based educational environment. The article also offers insights into the use of Internet technology as a versatile delivery medium for both teaching and the practice of marketing. This planned mode of instruction resulted in a higher degree of interactive learning, more effective instruction, enhanced communication and collaboration, and a more accurate assessment of the learning effectiveness in comparison with conventional methods."
"358","Going Online: Building Your Business Law Course Using the Quality Matters Rubric.","Lucas Loafman Barbara W Altman",2014,"Journal of Legal Studies Education","6f159f1e-1786-35ab-9cd6-257fb166e402","LAW & economics -- Study & teaching LEGAL professions PROBLEM-based learning TEXAS A & M University WEB-based instruction","The article focuses on designing of an online business law course\nwith the standards of the Quality Matters (QM) Rubric program at\nthe Texas A&M University-Central Texas. Topics discussed include\nprinciples in online education such as active learning techniques,\nability of the program to go through the QM review process for external\nvalidation of the quality of their course design, and eight design\nstandards to determine whether a course meets Universal Design for\nLearning (UDL)."
"359","Five Principles for Workable Client-Based Projects: Lessons from the Trenches","T. B. Lopez",2005,"Journal of Marketing Education","22d45943-9813-32d6-82e2-3e032e45eba3","and greatly enhance students business education client projects client-based projects help course concepts come to life course design experiential learning in our own experiences marketing education owner-","Despite the wide-ranging benefits of using client-based projects (CBPs) in the classroom, such projects can be overwhelming for instructors, and many shy away from the considerable workload and time commitment often required by CBPs. This article is designed to help marketing educators overcome such apprehensions and provide them with concrete tools to simplify CBPs and make them easier to manage. The authors discuss five principles they have developed for creating and implementing workable client projects. Their principles come directly ""from the trenches"" of their own experiences in planning and managing client-based projects across multiple courses. They address, for example, ways to customize CBPs to fit within specific course and professor time constraints, tips to manage the client relationship and students' expectations, and strategies to streamline the feedback process. They offer workbench-level insights and practices drawn from their own experiences that instructors can put into practice immediately."
"360","The Effects of Team Personality Awareness Exercises on Team Satisfaction and Performance: The Context of Marketing Course Projects","M. P. Lancellotti T. Boyd",2008,"Journal of Marketing Education","7c077992-3d89-33f4-a4fd-059ef4265a44","communication considerable research has found curric- eamwork is a critical element of business school personality satisfaction self-regulation teams that students bene- ula","Marketing courses heavily utilize team projects that can enhance student learning and make students more desirable to recruiters seeking greater teamwork skills and experience from students. Unfortunately team projects that provide opportunities to learn and improve such skills can also be great sources of frustration and dissatisfaction for instructors and students. This research investigates the effects of exercises designed to encourage student reflection on their behavior as team members and engage in proactive communications with teammates. The exercises are based on a set of humorous personality types derived from common maladaptive student behavior in teams (e.g., “The Dictator,” “The Monarchist”). The exercises are tested in a field study, which shows their use results in greater student satisfaction with the team and team output. They also result in increased student learning as measured by improved team project performance and better individual exam and course grades compared to students who engage in the same team projects without participating in the exercises. Details on the personalities and how to run the exercises are provided along with reflections from 8 years of their use in the classroom."
"361","Improving Teaching through Improving Evaluation: A Guide to Course Portfolios","Debra a. Laverie",2002,"Journal of Marketing Education","24e5b906-64a0-3599-991d-3c82dcef2de4",NA,"This article demonstrates how course portfolios can be used by marketing faculty members to enhance their teaching effectiveness. Course portfolios are a mechanism by which faculty memberscan exhibit their teaching accomplishments for examination by others. This method affords faculty membersthe opportunity to obtain peer review of their teaching in much the same manner as they receive peer review of their research. Through collaboration, faculty members can improve their teaching at a time when many institutions of higher learning are placing increased emphasis on effective teaching. Specific guidelinesare given for constructing the portfolio and for obtaining peer review. Finally, excerptsfrom a marketing course portfolio are used to show possible components of a marketing course portfolio."
"362","A Broadened Sales Curriculum: Exploratory Evidence","B. Leisen",2004,"Journal of Marketing Education","1adaa489-d381-3017-8ac6-30864c169c9f","alumni business education marketing sales","This article describes research aimed at aligning education offerings with practitioner views of what topics should be offered in a marketing education. Data were collected across two investigations. In Study 1, a typical profile of marketing curriculum was developed by reviewing marketing programs at AACSB-accredited schools. This typical profile was then reviewed and critiqued by business executives who also offered ideas they felt would improve the curriculum, resulting in a main focus on sales. Study 2 entailed a survey of practitioners to determine which marketing topics would be most useful in an expanded sales education. Implementation ideas are presented to suggest ways in which marketing curricula could be adapted to include these curriculum ideas."
"363","Ethical Considerations in Filing Personal Bankruptcy : A Hypothetical Case Study","Robert J Landry I Introduction",2012,"Journal of Legal Studies Education","db989358-2fe6-3e6d-90da-16dd17bc4a67",NA,NA
"364","Is Twitter for the Birds? Using Twitter to Enhance Student Learning in a Marketing Course","B. Lowe D. Laffey",2011,"Journal of Marketing Education","981a99d2-14e7-3af2-b59a-8cf9f222c550","H Social Sciences (General)","Recent years have seen unprecedented possibilities for the use of different technologies to enhance learning in marketing courses. Given the rapid and widespread diffusion of these technologies, particularly within the demographic of the student population, it is pertinent to explore and examine how such technologies can benefit student learning. This article discusses and empirically evaluates students’ experiences of using Twitter as a tool to facilitate learning in marketing courses. Although Twitter’s unique characteristics were used to enhance and facilitate the learning of marketing concepts, the use of Twitter also helped illustrate marketers’ use of innovative technologies and, therefore, added valuable contemporary curriculum content. Using in-depth interviews, and a questionnaire to evaluate learning outcomes, this research concludes that students’ perceptions of using Twitter were largely positive, though some anticipated and unanticipated barriers emerged to incorporating Twitter into marketing courses. Recommendations for adopting Twitter into the marketing curriculum are made, and future areas for research are identified."
"365","Marketing Educator Internet Adoption in 1998 versus 2000: Significant Progress and Remaining Obstacles","D. J. Lincoln",2001,"Journal of Marketing Education","9baa0545-5829-3439-8b69-c99e1458b44c",NA,NA
"366","Reflections on Enhancing the Understanding of Law through Ethical Analysis","Murray S Levin",2010,"Journal of Legal Studies Education","ca14bfe5-923f-3f2e-864a-d2baf1ab67c4","Business Administration Education; Law Related Edu","There are varied approaches to incorporating the subject of ethics in the business school curriculum. The evolving process has included a debate over fundamental matters such as whether all students should be required to take a discrete course in ethics, who should be teaching ethics, and whether ethics can even be taught. The ethics subject matter has a history of association with business law and legal environment of business courses, and within the legal studies in business discipline one also finds a variety of approaches to the study of ethics. This article focuses on the pedagogy of introducing hypothetical fact problems/questions during early exposure to the topic of ethics and then later revisiting those same fact problems in connection with the study of various related business law topics (what the author refers to as ""unified pedagogy""). This approach emphasizes the close relationship between ethics and law and the benefit of appreciating underlying values when learning about law. (Contains 42 footnotes.)"
"367","The Editor's Corner","D. J. Lincoln",2002,"Journal of Marketing Education","cb4afe73-921c-3ed2-a960-372fdf5d5ae5",NA,NA
"368","Assurance of Learning for Principles of Marketing Students: A Longitudinal Study of a Course-Embedded Direct Assessment","E. K. LaFleur L. a. Babin T. B. Lopez",2009,"Journal of Marketing Education","48403516-106c-3ac3-98b9-c54ad23ff885","aacsb accreditation assessment assurance of learning marketing education",NA
"369","Teaching Experiential Learning: Adoption of an Innovative Course in an MBA Marketing Curriculum","T. Li B. a. Greenberg J. a. F. Nicholls",2007,"Journal of Marketing Education","9c94e861-bb29-3042-9c4d-4cc67d23e3b9","experiential learning innovation diffusion","Colleges of business administration are under continuing pressure to develop innovative courses to meet demands from the business community. At the same time, faculty members are facing increasing challenges in adopting innovative technologies because of the amount of risk and effort involved. This article examines the adoption of Marketplace, a purely experiential learning course, in an MBA curriculum. The investigation shows that group dynamics and product characteristics were two key factors in the success of the innovation adoption. Findings from an empirical study demonstrate that the students perceived the simulation course as a viable alternative to the lecture-based pedagogy."
"370","Assessing Teamwork Skills for Assurance of Learning Using CATME Team Tools","M. L. Loughry M. W. Ohland D. J. Woehr",2013,"Journal of Marketing Education","6bcc3051-9208-36a0-a657-dc215293fc93","a feasible accreditation assurance of learning business do not have for graduates of business peer evaluation schools team skills teamwork teamwork skills are essential yet many colleges of",NA
"371","An Exercise for Teaching the Employment Law Implications of Employee Blogging","Konrad S Lee Matthew I Thue Jared Oldham Michael Hanscom",2009,"Journal of Legal Studies Education","506b6822-a2f8-38d4-ab7d-40cd61da7a63",NA,NA
"372","When Students Complain: An Antecedent Model of Students' Intention to Complain","V. Lala R. Priluck",2011,"Journal of Marketing Education","db83116c-f4c5-385e-b891-37c4dc82ebed","an important customer relation- college student retention is complain particularly among ship management task for structural equation modeling students universities web","This article explores the factors that influence students' intention to complain following a bad classroom experience using a customer service framework from the marketing literature. An online survey was conducted with 288 participants using the critical incident approach. Results indicate that predictors of intention to complain differ based on the target of complaint behavior (school, friends, or unknown others) and the mode of complaint (in person or using the web). Specifically, the more dissatisfied students are, the more likely they are to complain to the school and to friends either in person or using the web but not to unknown others. Students complain to the school only if the effort involved is minimal and they believe the school will respond. Students complain to friends and unknown others in person if they feel the school will respond to negative press. Personal characteristics also influence intentions to complain. Students with a propensity to complain broadcast their negative experience via the web, grade conscious students tell their friends but only in person, and heavy social media users inform their friends using the web. Implications for faculty and administrators are discussed. (Contains 1 figure and 5 tables.)"
"373","Enhancing Student Motivation in Marketing Classes: Using Student Management Groups","B. Lilly M. J. Tippins",2002,"Journal of Marketing Education","04fc5727-23e5-35bc-b1a8-c8da51597b7d",NA,"This article discusses student management groups (SMGs) and explains how these groups help stimulate class interaction and enhance student motivation to learn. After reviewing the concepts of motivation and immediacy, the article discusses how SMGs reduce perceived student-professor distance and encourage students to become more intrinsically motivated by participating in class governance issues. Presented next are the results of three studies. The first study examines qualitative feedback gathered from students and evaluates several benefits and drawbacks associated with using SMGs. A second study uses an experimental design to test the effects of SMGs on anticipated motivation across different class types. Finally, the third study reports feedback from professors to gauge their reactions to the SMG process. Research implications and suggestions for implementing SMGs are also discussed."
"374","The Editor's Corner","Unknown editor",2011,"Journal of Marketing Education","05598f5e-bfc5-3cde-8210-cfbc035197e0",NA,NA
"375","Perceptions and Reality: Creativity in the Marketing Classroom","D. E. McCorkle J. M. Payan J. Reardon N. D. Kling",2007,"Journal of Marketing Education","9dc862b4-0687-3340-b033-6431f924fe4a","creativity marketing educa- supporting skills","According to both the popular press and academia, creativity is an important skill for business practice and marketing education. This article addresses ""What is creativity?"" and ""Can creativity be taught or nurtured?"" and provides an analysis of both student perceptions about creativity and their levels of creativity. The results indicate that both business and marketing students perceived creativity as important to their career. Marketing students placed greater importance on creativity than other business students and found creativity to be as important to their careers as other important skills (e.g., writing, oral presentation, teamwork, etc.). It was also found that the marketing and other business students believed that creativity is a skill that can be learned. Although marketing students have a better appreciation of the importance of creativity than other business students, they do not appear to be more creative than other business students or nonbusiness students. © 2007 Sage Publications."
"376","It's Not Easy Being Green: Bringing Real Life to the Undergraduate Legal Environment of Business Classroom","Tanya M Marcum Sandra J Perry",2010,"Journal of Legal Studies Education","323fc72d-47c7-3c54-b422-b5cac5b170d2","Business Education Case Method (Teaching Technique) Classroom Techniques Conservation (Environment) Court Litigation Instructional Design Instructional Effectiveness Law Related Education Legal Problems Student Attitudes Sustainable Development Teaching Methods Undergraduate Study","In the Legal Environment of Business course in a traditional undergraduate business curriculum, students are expected to acquire knowledge about many areas of the law and the application of law to business, society, and the international marketplace. Current concepts in undergraduate business education, such as ethics and sustainability, must also be included in one's classrooms. Some texts highlight issues with landmark cases or feature articles about businesses that have experienced high-profile legal and/or ethical dilemmas. Using high-profile cases and newsworthy business situations are useful in stimulating discussions. However, professors often struggle with keeping students engaged while in the classroom. Real-world examples in the classroom have the best pedagogical value because of their appeal to traditional college students. This article features TerraCycle, Inc., a business that can portray many of the legal principles taught in a Legal Environment of Business course, and this business is interesting to students. This business and its actual litigation with a competitor, coupled with hypothetical legal issues faced by typical businesses, can be used as a basis for discussion for the entire semester to illustrate many of the principles of a typical Legal Environment of Business course. Although this semester-long case study focused on this particular start-up business, any business of interest to students can be used. The authors discuss how to connect TerraCycle, Inc. to students and how it can be utilized for lessons in the classroom. (Contains 3 figures and 28 footnotes.)"
"377","Individual Characteristics and Creativity in the Marketing Classroom: Exploratory Insights","Faye S. McIntyre Robert E. Hite Mary K. Rickard",2003,"Journal of Marketing Education","f48eea7f-be8f-3afc-b3ff-cef5cdf07f9e","creativity education execu- gender marketing",NA
